{
  "title": "Faire une pause sans couper le dialogue",
  "summary": "Dites que vous avez besoin de temps pour réfléchir, puis revenez à la conversation.",
  "points": [
    {
      "id": "stonewalling",
      "title": "Faire obstruction, c'est se retirer",
      "sentences": [
        "L'obstruction est l'un des quatre cavaliers.",
        "Submergée par ses émotions, une personne se retire de la conversation.",
        "Elle se tait, change de sujet ou quitte la pièce."
      ],
      "outline": ["Se taire", "Changer de sujet", "Quitter la pièce"]
    },
    {
      "id": "problem",
      "title": "Le problème reste sans solution",
      "sentences": [
        "L'autre personne se sent ignorée ou rejetée.",
        "Rien ne se règle, et le problème reste entier."
      ],
      "outline": ["L'autre personne se sent ignorée", "Le problème reste entier"]
    },
    {
      "id": "time-out",
      "title": "Prenez plutôt une pause",
      "sentences": [
        "Dites que vous avez besoin de temps pour réfléchir.",
        "Revenez ensuite à la conversation.",
        "L'autre personne sait que vous ne l'avez pas abandonnée."
      ],
      "example": [
        "Par exemple, Roxanne a tendance à se replier quand quelqu'un la contrarie.",
        "Elle dit maintenant : \"J'ai besoin de temps pour réfléchir. Est-ce qu'on peut en parler demain matin?\"",
        "Le lendemain matin, elle reprend la conversation."
      ],
      "outline": ["Dire que vous avez besoin de temps pour réfléchir", "Revenir à la conversation"],
      "exampleOutline": "Exemple. Roxanne demande du temps, puis reprend la conversation le lendemain matin."
    }
  ],
  "quiz": [
    {
      "section": "stonewalling",
      "prompt": "Pendant une réunion tendue, Michel sent sa colère monter. Comment peut-il prendre une pause plutôt que faire obstruction?",
      "options": [
        { "text": "Fixer son écran sans répondre jusqu'à la fin de la réunion", "feedback": "C'est de l'obstruction. Il se retire sans un mot, et les autres se sentent ignorés." },
        { "text": "Dire qu'il a besoin de quelques minutes, puis revenir à la discussion", "feedback": "Il annonce sa pause et revient à la discussion.", "correct": true },
        { "text": "Quitter la pièce sans un mot pour se calmer", "feedback": "Se calmer est utile. S'il ne dit rien, les autres peuvent se sentir abandonnés." },
        { "text": "Changer de sujet pour apaiser la tension", "feedback": "Changer de sujet est une forme d'obstruction. Le problème reste entier." }
      ]
    },
    {
      "section": "time-out",
      "prompt": "Qu'est-ce qui distingue une pause de l'obstruction?",
      "options": [
        { "text": "La pause est courte", "feedback": "La durée n'est pas le critère. Un court silence sans explication reste de l'obstruction." },
        { "text": "Vous restez dans la pièce", "feedback": "Fixer un écran dans la pièce est aussi une forme d'obstruction." },
        { "text": "Vous dites que vous avez besoin de temps, puis vous revenez", "feedback": "Annoncer votre besoin de temps et revenir, c'est ce qui en fait une pause.", "correct": true }
      ]
    }
  ]
}
