{
  "title": "Take a pause without closing the conversation",
  "summary": "Say that you need time to think, then come back to the conversation.",
  "points": [
    {
      "id": "stonewalling",
      "title": "Stonewalling is withdrawing",
      "sentences": [
        "Stonewalling is one of the four horsemen.",
        "Flooded by emotion, a person withdraws from the conversation.",
        "They go quiet, change the subject or leave the room."
      ],
      "outline": [
        "Going quiet",
        "Changing the subject",
        "Leaving the room"
      ]
    },
    {
      "id": "problem",
      "title": "It leaves the problem open",
      "sentences": [
        "The other person feels ignored or rejected.",
        "Nothing gets resolved, so the problem stays open."
      ],
      "outline": [
        "The other person feels ignored",
        "The problem stays open"
      ]
    },
    {
      "id": "time-out",
      "title": "Take a time-out instead",
      "sentences": [
        "Say that you need time to think.",
        "Then come back to the conversation.",
        "The other person knows you haven't abandoned them."
      ],
      "example": [
        "For example, Roxanne tends to pull back when someone upsets her.",
        "Now she says, \"I need time to think. Can we talk tomorrow morning?\"",
        "The next morning, she comes back to the conversation."
      ],
      "outline": [
        "Say you need time to think",
        "Come back to the conversation"
      ],
      "exampleOutline": "Example. Roxanne asks for time, then comes back the next morning."
    }
  ],
  "quiz": [
    {
      "section": "stonewalling",
      "prompt": "In a tense meeting, Michel feels his anger rising. How can he take a time-out rather than stonewall?",
      "options": [
        {
          "text": "Stare at his screen without answering until the meeting ends",
          "feedback": "That's stonewalling. He withdraws without a word, and the others feel ignored."
        },
        {
          "text": "Say he needs a few minutes, then come back to the discussion",
          "feedback": "He says he needs a pause and comes back.",
          "correct": true
        },
        {
          "text": "Leave the room without a word to calm down",
          "feedback": "Calming down helps. Without saying so, the others may feel abandoned."
        },
        {
          "text": "Change the subject to ease the tension",
          "feedback": "Changing the subject is stonewalling. The problem stays open."
        }
      ]
    },
    {
      "section": "time-out",
      "prompt": "What makes a pause a time-out rather than stonewalling?",
      "options": [
        {
          "text": "The pause is short",
          "feedback": "Length isn't the test. A short silence with no word is still stonewalling."
        },
        {
          "text": "You stay in the room",
          "feedback": "Staring at a screen in the room is stonewalling too."
        },
        {
          "text": "You say you need time, then come back",
          "feedback": "Saying so and coming back is what makes it a time-out.",
          "correct": true
        }
      ]
    }
  ]
}
